<?xml version="1.0" encoding="utf-8" standalone="yes"?>
<rtcDataConfig xmlns:xsi="http://www.w3.org/2001/XMLSchema-instance" xmlns:rtc="http://www.wldelft.nl/fews" xmlns="http://www.wldelft.nl/fews" xsi:schemaLocation="http://www.wldelft.nl/fews D:\4390.10\HYDROLIB\hydrolib\tests\New%20folder\New%20folder%20(2)\rtc\rtcDataConfig.xsd">
  <importSeries>
    <PITimeSeriesFile>
      <timeSeriesFile>timeseries_import.xml</timeSeriesFile>
      <useBinFile>false</useBinFile>
    </PITimeSeriesFile>
    <timeSeries id="[Input]ObsS_96789/Water level (op)">
      <OpenMIExchangeItem>
        <elementId>ObsS_96789</elementId>
        <quantityId>Water level (op)</quantityId>
        <unit>m</unit>
      </OpenMIExchangeItem>
    </timeSeries>
  </importSeries>
  <exportSeries>
    <CSVTimeSeriesFile decimalSeparator="." delimiter="," adjointOutput="false"></CSVTimeSeriesFile>
    <PITimeSeriesFile>
      <timeSeriesFile>timeseries_export.xml</timeSeriesFile>
      <useBinFile>false</useBinFile>
    </PITimeSeriesFile>
    <timeSeries id="[Output]S_96789/Crest level (s)">
      <OpenMIExchangeItem>
        <elementId>S_96789</elementId>
        <quantityId>Crest level (s)</quantityId>
        <unit>m</unit>
      </OpenMIExchangeItem>
    </timeSeries>
  <timeSeries id="[IP]Control group S_96789/PID Rule" /> 
  <timeSeries id="[DP]Control group S_96789/PID Rule" /> 
  </exportSeries>
</rtcDataConfig>